{
  "schema-version": 1,
  "generated-at": "2026-05-09T08:12:53.334Z",
  "source": "skills/**/SKILL.md",
  "thresholds": {
    "due-soon-days": 7
  },
  "summary": {
    "governed-skills": 34,
    "overdue": 0,
    "due-soon": 0,
    "scheduled": 34,
    "missing-metadata": 0,
    "stable-overdue": 0,
    "stable-missing-metadata": 0
  },
  "skills": [
    {
      "skill": "pre-commit-gate",
      "kind": "guard",
      "status": "stable",
      "owner": "self",
      "file": "skills/guards/pre-commit-gate/SKILL.md",
      "last-reviewed": "2026-04-17",
      "review-cycle-days": 30,
      "review-status": "scheduled",
      "priority": "normal",
      "next-review-due": "2026-05-17",
      "days-until-due": 8,
      "overdue-days": 0
    },
    {
      "skill": "pre-merge-gate",
      "kind": "guard",
      "status": "stable",
      "owner": "self",
      "file": "skills/guards/pre-merge-gate/SKILL.md",
      "last-reviewed": "2026-04-17",
      "review-cycle-days": 30,
      "review-status": "scheduled",
      "priority": "normal",
      "next-review-due": "2026-05-17",
      "days-until-due": 8,
      "overdue-days": 0
    },
    {
      "skill": "verify-security",
      "kind": "tool",
      "status": "stable",
      "owner": "self",
      "file": "skills/tools/verify-security/SKILL.md",
      "last-reviewed": "2026-04-17",
      "review-cycle-days": 30,
      "review-status": "scheduled",
      "priority": "normal",
      "next-review-due": "2026-05-17",
      "days-until-due": 8,
      "overdue-days": 0
    },
    {
      "skill": "skill-evolution",
      "kind": "workflow",
      "status": "stable",
      "owner": "self",
      "file": "skills/workflows/skill-evolution/SKILL.md",
      "last-reviewed": "2026-04-18",
      "review-cycle-days": 30,
      "review-status": "scheduled",
      "priority": "normal",
      "next-review-due": "2026-05-18",
      "days-until-due": 9,
      "overdue-days": 0
    },
    {
      "skill": "verify-skill-system",
      "kind": "tool",
      "status": "stable",
      "owner": "self",
      "file": "skills/tools/verify-skill-system/SKILL.md",
      "last-reviewed": "2026-04-18",
      "review-cycle-days": 30,
      "review-status": "scheduled",
      "priority": "normal",
      "next-review-due": "2026-05-18",
      "days-until-due": 9,
      "overdue-days": 0
    },
    {
      "skill": "bugfix",
      "kind": "workflow",
      "status": "stable",
      "owner": "self",
      "file": "skills/workflows/bugfix/SKILL.md",
      "last-reviewed": "2026-04-17",
      "review-cycle-days": 45,
      "review-status": "scheduled",
      "priority": "normal",
      "next-review-due": "2026-06-01",
      "days-until-due": 23,
      "overdue-days": 0
    },
    {
      "skill": "gen-docs",
      "kind": "tool",
      "status": "stable",
      "owner": "self",
      "file": "skills/tools/gen-docs/SKILL.md",
      "last-reviewed": "2026-04-17",
      "review-cycle-days": 45,
      "review-status": "scheduled",
      "priority": "normal",
      "next-review-due": "2026-06-01",
      "days-until-due": 23,
      "overdue-days": 0
    },
    {
      "skill": "infrastructure",
      "kind": "domain",
      "status": "stable",
      "owner": "self",
      "file": "skills/domains/infrastructure/SKILL.md",
      "last-reviewed": "2026-04-17",
      "review-cycle-days": 45,
      "review-status": "scheduled",
      "priority": "normal",
      "next-review-due": "2026-06-01",
      "days-until-due": 23,
      "overdue-days": 0
    },
    {
      "skill": "investigate",
      "kind": "workflow",
      "status": "stable",
      "owner": "self",
      "file": "skills/workflows/investigate/SKILL.md",
      "last-reviewed": "2026-04-17",
      "review-cycle-days": 45,
      "review-status": "scheduled",
      "priority": "normal",
      "next-review-due": "2026-06-01",
      "days-until-due": 23,
      "overdue-days": 0
    },
    {
      "skill": "multi-agent",
      "kind": "workflow",
      "status": "stable",
      "owner": "self",
      "file": "skills/workflows/multi-agent/SKILL.md",
      "last-reviewed": "2026-04-17",
      "review-cycle-days": 45,
      "review-status": "scheduled",
      "priority": "normal",
      "next-review-due": "2026-06-01",
      "days-until-due": 23,
      "overdue-days": 0
    },
    {
      "skill": "orchestration",
      "kind": "domain",
      "status": "stable",
      "owner": "self",
      "file": "skills/domains/orchestration/SKILL.md",
      "last-reviewed": "2026-04-17",
      "review-cycle-days": 45,
      "review-status": "scheduled",
      "priority": "normal",
      "next-review-due": "2026-06-01",
      "days-until-due": 23,
      "overdue-days": 0
    },
    {
      "skill": "review",
      "kind": "workflow",
      "status": "stable",
      "owner": "self",
      "file": "skills/workflows/review/SKILL.md",
      "last-reviewed": "2026-04-17",
      "review-cycle-days": 45,
      "review-status": "scheduled",
      "priority": "normal",
      "next-review-due": "2026-06-01",
      "days-until-due": 23,
      "overdue-days": 0
    },
    {
      "skill": "security",
      "kind": "domain",
      "status": "stable",
      "owner": "self",
      "file": "skills/domains/security/SKILL.md",
      "last-reviewed": "2026-04-17",
      "review-cycle-days": 45,
      "review-status": "scheduled",
      "priority": "normal",
      "next-review-due": "2026-06-01",
      "days-until-due": 23,
      "overdue-days": 0
    },
    {
      "skill": "ship",
      "kind": "workflow",
      "status": "stable",
      "owner": "self",
      "file": "skills/workflows/ship/SKILL.md",
      "last-reviewed": "2026-04-17",
      "review-cycle-days": 45,
      "review-status": "scheduled",
      "priority": "normal",
      "next-review-due": "2026-06-01",
      "days-until-due": 23,
      "overdue-days": 0
    },
    {
      "skill": "verify-change",
      "kind": "tool",
      "status": "stable",
      "owner": "self",
      "file": "skills/tools/verify-change/SKILL.md",
      "last-reviewed": "2026-04-17",
      "review-cycle-days": 45,
      "review-status": "scheduled",
      "priority": "normal",
      "next-review-due": "2026-06-01",
      "days-until-due": 23,
      "overdue-days": 0
    },
    {
      "skill": "verify-module",
      "kind": "tool",
      "status": "stable",
      "owner": "self",
      "file": "skills/tools/verify-module/SKILL.md",
      "last-reviewed": "2026-04-17",
      "review-cycle-days": 45,
      "review-status": "scheduled",
      "priority": "normal",
      "next-review-due": "2026-06-01",
      "days-until-due": 23,
      "overdue-days": 0
    },
    {
      "skill": "verify-quality",
      "kind": "tool",
      "status": "stable",
      "owner": "self",
      "file": "skills/tools/verify-quality/SKILL.md",
      "last-reviewed": "2026-04-17",
      "review-cycle-days": 45,
      "review-status": "scheduled",
      "priority": "normal",
      "next-review-due": "2026-06-01",
      "days-until-due": 23,
      "overdue-days": 0
    },
    {
      "skill": "manage-skill",
      "kind": "tool",
      "status": "stable",
      "owner": "self",
      "file": "skills/tools/manage-skill/SKILL.md",
      "last-reviewed": "2026-05-05",
      "review-cycle-days": 30,
      "review-status": "scheduled",
      "priority": "normal",
      "next-review-due": "2026-06-04",
      "days-until-due": 26,
      "overdue-days": 0
    },
    {
      "skill": "ai",
      "kind": "domain",
      "status": "stable",
      "owner": "self",
      "file": "skills/domains/ai/SKILL.md",
      "last-reviewed": "2026-04-17",
      "review-cycle-days": 60,
      "review-status": "scheduled",
      "priority": "normal",
      "next-review-due": "2026-06-16",
      "days-until-due": 38,
      "overdue-days": 0
    },
    {
      "skill": "architecture",
      "kind": "domain",
      "status": "stable",
      "owner": "self",
      "file": "skills/domains/architecture/SKILL.md",
      "last-reviewed": "2026-04-17",
      "review-cycle-days": 60,
      "review-status": "scheduled",
      "priority": "normal",
      "next-review-due": "2026-06-16",
      "days-until-due": 38,
      "overdue-days": 0
    },
    {
      "skill": "architecture-decision",
      "kind": "workflow",
      "status": "stable",
      "owner": "self",
      "file": "skills/workflows/architecture-decision/SKILL.md",
      "last-reviewed": "2026-04-17",
      "review-cycle-days": 60,
      "review-status": "scheduled",
      "priority": "normal",
      "next-review-due": "2026-06-16",
      "days-until-due": 38,
      "overdue-days": 0
    },
    {
      "skill": "data-engineering",
      "kind": "domain",
      "status": "stable",
      "owner": "self",
      "file": "skills/domains/data-engineering/SKILL.md",
      "last-reviewed": "2026-04-17",
      "review-cycle-days": 60,
      "review-status": "scheduled",
      "priority": "normal",
      "next-review-due": "2026-06-16",
      "days-until-due": 38,
      "overdue-days": 0
    },
    {
      "skill": "development",
      "kind": "domain",
      "status": "stable",
      "owner": "self",
      "file": "skills/domains/development/SKILL.md",
      "last-reviewed": "2026-04-17",
      "review-cycle-days": 60,
      "review-status": "scheduled",
      "priority": "normal",
      "next-review-due": "2026-06-16",
      "days-until-due": 38,
      "overdue-days": 0
    },
    {
      "skill": "devops",
      "kind": "domain",
      "status": "stable",
      "owner": "self",
      "file": "skills/domains/devops/SKILL.md",
      "last-reviewed": "2026-04-17",
      "review-cycle-days": 60,
      "review-status": "scheduled",
      "priority": "normal",
      "next-review-due": "2026-06-16",
      "days-until-due": 38,
      "overdue-days": 0
    },
    {
      "skill": "frontend-design",
      "kind": "domain",
      "status": "stable",
      "owner": "self",
      "file": "skills/domains/frontend-design/SKILL.md",
      "last-reviewed": "2026-04-17",